Data_Hora,Id_Tweet,Tweet,Candidato,Tweet_limpo
2022-08-01 22:40:47+00:00,1554235721728270338,Datafolha: 61% dos eleitores dizem que objetivo do Auxílio Brasil é comprar votos para Bolsonaro https://t.co/sER9OhVkY3,Bolsonaro,datafolha: 61% dos eleitores dizem que objetivo do auxílio brasil é comprar votos para bolsonaro 
2022-08-01 22:40:46+00:00,1554235720256167939,"Bolsonaro é o primeiro brasileiro entrevistado do Censo 2022, VEJA VÍDEO https://t.co/gf3wTm3vWl",Bolsonaro,"bolsonaro é o primeiro brasileiro entrevistado do censo 2022, veja vídeo "
2022-08-01 22:40:45+00:00,1554235717311766528,Datafolha: 61% dos eleitores dizem que objetivo do Auxílio Brasil é comprar votos para Bolsonaro https://t.co/gThV2vTv5l,Bolsonaro,datafolha: 61% dos eleitores dizem que objetivo do auxílio brasil é comprar votos para bolsonaro 
2022-08-01 22:40:45+00:00,1554235713939542017,"@filipetrielli @antoniotabet para você falta pouco, só falta o óculos escuro dentro do carro e votar no Bolsonaro pois cara de corno você já tem...",Bolsonaro,"  para você falta pouco, só falta o óculos escuro dentro do carro e votar no bolsonaro pois cara de corno você já tem..."
2022-08-01 22:40:44+00:00,1554235712169545736,@Paulinha_Brisa @jairbolsonaro @mqueiroga2 @jairbolsonaro sanciona a #PL2564,Bolsonaro,    sanciona a 
2022-08-01 22:40:43+00:00,1554235706003922944,"@jairbolsonaro Parece que certo alguém não precisa ofender ninguém pra tentar ganhar votos, este ganha com ações",Bolsonaro," parece que certo alguém não precisa ofender ninguém pra tentar ganhar votos, este ganha com ações"
2022-08-01 22:40:43+00:00,1554235705441796096,"Mas que ABSUUURDA as farpas do Presidente do @TSEjusbr ao @jairbolsonaro !!!
Quando @SenadoFederal ???
Quando o @SenadoFederal vai se pronunciar e se fazer presente aos DESMANDOS do @STF_oficial ???
Querer mais segurança nas urnas NÃO É FALE NEWS!!!!",Bolsonaro,mas que absuuurda as farpas do presidente do  ao  !!!quando  ???quando o  vai se pronunciar e se fazer presente aos desmandos do  ???querer mais segurança nas urnas não é fale news!!!!
2022-08-01 22:40:42+00:00,1554235701067128832,"Governo Bolsonaro, Rio de Janeiro, 2022. https://t.co/mZlFXIK587",Bolsonaro,"governo bolsonaro, rio de janeiro, 2022. "
2022-08-01 22:40:42+00:00,1554235700723204097,@Jouberth19 Jair Bolsonaro,Bolsonaro, jair bolsonaro
2022-08-01 22:40:41+00:00,1554235699620200449,"Isso é o que espera o Brasil. Familícia Bozonaro.
Câmara dos EUA avalia incluir Eduardo Bolsonaro em investigação sobre ataque ao Capitólio @estadao:  https://t.co/P6LLSUWE3m",Bolsonaro,isso é o que espera o brasil. familícia bozonaro.câmara dos eua avalia incluir eduardo bolsonaro em investigação sobre ataque ao capitólio   
2022-08-01 22:40:41+00:00,1554235699490131969,rezando para o brasil voltar a ser monarquia e a laurinha bolsonaro liderar o pais https://t.co/ti8u9mmxlb,Bolsonaro,rezando para o brasil voltar a ser monarquia e a laurinha bolsonaro liderar o pais 
2022-08-01 22:40:41+00:00,1554235698483499008,"@JoaquinTeixeira @jairbolsonaro Kkkkkkk acho que nao vai rolar, literalmente falando, afinal ele tem amor a vida!",Bolsonaro,"  kkkkkkk acho que nao vai rolar, literalmente falando, afinal ele tem amor a vida!"
2022-08-01 22:40:41+00:00,1554235697220943872,@jairbolsonaro Toma!!!,Bolsonaro, toma!!!
2022-08-01 22:40:40+00:00,1554235695862108162,"@jairbolsonaro 
Senhor presidente, por favor utilizar a caneta big aí para liberar o hash code #pronampe para os MEI estamos no aguardo mas esse pessoal da receita aí tá enrolando. Obrigado",Bolsonaro," senhor presidente, por favor utilizar a caneta big aí para liberar o hash code  para os mei estamos no aguardo mas esse pessoal da receita aí tá enrolando. obrigado"
2022-08-01 22:40:40+00:00,1554235693836156933,"@MiszPeregrino @BiachiSergio @carmelonetobr @jairbolsonaro Vc já viu o que o socialismo faz com um INDIVÍDUO? Independente da cor, sexo, etnia e classe social? Deixa pobre, miserável e faminto. E o comunista? Geralmente são, homofóbicos, racistas, MACHISTA. Mas tudo bem vc aprendeu com Paulo freire que Che era paz e amor.",Bolsonaro,"    vc já viu o que o socialismo faz com um indivíduo? independente da cor, sexo, etnia e classe social? deixa pobre, miserável e faminto. e o comunista? geralmente são, homofóbicos, racistas, machista. mas tudo bem vc aprendeu com paulo freire que che era paz e amor."
2022-08-01 22:40:38+00:00,1554235687955742721,"BOLSONARO NÃO TRABALHA, mas rouba verba pública https://t.co/8MQvM7wB84",Bolsonaro,"bolsonaro não trabalha, mas rouba verba pública "
2022-08-01 22:40:37+00:00,1554235679827271682,@jairbolsonaro Kkkkkkkkkk https://t.co/qYElNu8hWh,Bolsonaro, kkkkkkkkkk 
2022-08-01 22:40:35+00:00,1554235674030751747,"@JoseMedeirosMT @jairbolsonaro Vcs podem viver sem a Renner, mas a Renner com certeza QUER VIVER BEM LONGE DE VOCÊS. A empresa que preza pela diversidade e aceitação do diferente, por DEMOCRACIA, não é lugar pra gente cafona, preconceituosa e antiquada. Continuem comprando na Havan, que tem mais a cara de vcs!",Bolsonaro,"  vcs podem viver sem a renner, mas a renner com certeza quer viver bem longe de vocês. a empresa que preza pela diversidade e aceitação do diferente, por democracia, não é lugar pra gente cafona, preconceituosa e antiquada. continuem comprando na havan, que tem mais a cara de vcs!"
2022-08-01 22:40:35+00:00,1554235672143200261,@marcelaagds @jairbolsonaro sanciona a #PL2564,Bolsonaro,  sanciona a 
2022-08-01 22:40:34+00:00,1554235668083220484,@VEJA #VEJALIXO BOLSONARO 22.,Bolsonaro,  bolsonaro 22.
2022-08-01 22:40:34+00:00,1554235667282108418,"@CacaAlencar @BlogdoNoblat SEM LULA, bolsonaro sempre liderou no DATAFOLHA",Bolsonaro,"  sem lula, bolsonaro sempre liderou no datafolha"
2022-08-01 22:40:33+00:00,1554235666589921280,Bolsonaro é sorteado como primeiro presidenciável a ser entrevistado no Jornal Nacional https://t.co/ooApOeLQMB,Bolsonaro,bolsonaro é sorteado como primeiro presidenciável a ser entrevistado no jornal nacional 
2022-08-01 22:40:33+00:00,1554235665310703616,"@josuelisboa1999 @NegoLucinaldo @FlavioBolsonaro @jairbolsonaro Esquece o Presidente,cuida da sua vida 🙄",Bolsonaro,"    esquece o presidente,cuida da sua vida 🙄"
2022-08-01 22:40:33+00:00,1554235663695978498,"@hiperbolillian Vai ganhar com os pés nas costas. Não vai demorar muito pra ter o apoio do Nikolas, Malafaia e Bolsonaro.",Bolsonaro," vai ganhar com os pés nas costas. não vai demorar muito pra ter o apoio do nikolas, malafaia e bolsonaro."
2022-08-01 22:40:32+00:00,1554235662127304704,@jairbolsonaro Crlh 🤣🤣🤣🤣🤣🤣🤣🤣🤣 https://t.co/rNj3hroIIx,Bolsonaro, crlh 🤣🤣🤣🤣🤣🤣🤣🤣🤣 
2022-08-01 22:40:31+00:00,1554235655986810885,@RomeuZema MUITO OBRIGADO PRESIDENTE JAIR BOLSONARO!! 👏👏👏👏👏👏😎😎😎👉👉👉💥💥💥🇧🇷🇧🇷🇧🇷,Bolsonaro, muito obrigado presidente jair bolsonaro!! 👏👏👏👏👏👏😎😎😎👉👉👉💥💥💥🇧🇷🇧🇷🇧🇷
2022-08-01 22:40:30+00:00,1554235654518853633,@Simone78586113 @brealt Vai ser no primeiro turno o nosso presidente Bolsonaro,Bolsonaro,  vai ser no primeiro turno o nosso presidente bolsonaro
2022-08-01 22:40:29+00:00,1554235646843228167,@jairbolsonaro É o cara sempre de bom humor...,Bolsonaro, é o cara sempre de bom humor...
2022-08-01 22:40:28+00:00,1554235645484322818,@jairbolsonaro @antoniotabet chupa essa manga otario,Bolsonaro,  chupa essa manga otario
2022-08-01 22:40:27+00:00,1554235638198800384,"@NetoAntonelli @PedroRonchi2 @Estadao Atacam o Bolsonaro, Guedes sempre passaram e continuam passando pano",Bolsonaro,"   atacam o bolsonaro, guedes sempre passaram e continuam passando pano"
2022-08-01 22:40:26+00:00,1554235637548695553,@RomeuZema Meu sonho é ver Zema sucedendo nosso presidente @jairbolsonaro em 2026. 🙏🏆🚀🇧🇷✨🙌,Bolsonaro, meu sonho é ver zema sucedendo nosso presidente  em 2026. 🙏🏆🚀🇧🇷✨🙌
2022-08-01 22:40:26+00:00,1554235637322194945,"@Gochita_bella Que tal @jairbolsonaro ,como te quedará el ojo con el triunfo de @lulaharo",Bolsonaro," que tal  ,como te quedará el ojo con el triunfo de "
2022-08-01 22:40:26+00:00,1554235636600766464,Culpa do Bolsonaro claro kkkkkk https://t.co/nMfYLCJQxX,Bolsonaro,culpa do bolsonaro claro kkkkkk 
2022-08-01 22:40:26+00:00,1554235633685651462,@fabiofaria @jairbolsonaro O Orçamento Secreto também não para,Bolsonaro,  o orçamento secreto também não para
2022-08-01 22:40:25+00:00,1554235631412412418,@o_antagonista Mais um Boneco de posto do Bolsonaro. https://t.co/038WWYUI9D,Bolsonaro, mais um boneco de posto do bolsonaro. 
2022-08-01 22:40:24+00:00,1554235627151020035,@PinhoCleiton @jairbolsonaro @jairbolsonaro sanciona a #PL2564,Bolsonaro,   sanciona a 
2022-08-01 22:40:23+00:00,1554235622126133249,"@Censura94374125 @jairbolsonaro Cara palhaço esse ,qual o problema de oculos escuros ??? Pessoal se acha , são preconceituosos e arrogantes , não admitem ter perdido o poder que achavam q tinham",Bolsonaro,"  cara palhaço esse ,qual o problema de oculos escuros ??? pessoal se acha , são preconceituosos e arrogantes , não admitem ter perdido o poder que achavam q tinham"
2022-08-01 22:40:23+00:00,1554235621916434434,@Jouberth19 1 Bolsonaro,Bolsonaro, 1 bolsonaro
2022-08-01 22:40:22+00:00,1554235620628783104,@flferronato @atlancosta @ThiagoResiste Bolsonaro é o que Brasil precisa pelo menos por mais alguns 10 anos🙏🏻👍🏻,Bolsonaro,   bolsonaro é o que brasil precisa pelo menos por mais alguns 10 anos🙏🏻👍🏻
2022-08-01 22:42:50+00:00,1554236241150984192,"@alexandrebie Ciro Gomes é o contra o abuso dos bancos, vai taxar as gdes fortunas,acima de 20 Milhões e cobrar impostos sobre juros e dividendos. Só com esse dinheiro, garantirá a vaga de 100.000 cr no Ens. Integral. Eles estão defendendo o privilégio dos patrões. #PrefiroCiroPresidente12",Ciro Gomes," ciro gomes é o contra o abuso dos bancos, vai taxar as gdes fortunas,acima de 20 milhões e cobrar impostos sobre juros e dividendos. só com esse dinheiro, garantirá a vaga de 100.000 cr no ens. integral. eles estão defendendo o privilégio dos patrões. "
2022-08-01 22:42:22+00:00,1554236122737385475,Ciro viu o Lula se corromper e denunciou na data. #cirogomes #corrupção ... https://t.co/PHSq4k6f7Q via @YouTube,Ciro Gomes,ciro viu o lula se corromper e denunciou na data.   ...  via 
2022-08-01 22:42:18+00:00,1554236105532260357,@mmarescast @cirogomes @gioewbank Ciro é bolsonarento enrustido.,Ciro Gomes,   ciro é bolsonarento enrustido.
2022-08-01 22:42:09+00:00,1554236068102373376,@DudaSalabert @cirogomes 🌹,Ciro Gomes,  🌹
2022-08-01 22:42:09+00:00,1554236066160312322,@cirogomes @Cibele_12C Parabéns! Saúde e paz! 💐🙏🌹🤗🎂🍾🥂🍻👏👏👏,Ciro Gomes,  parabéns! saúde e paz! 💐🙏🌹🤗🎂🍾🥂🍻👏👏👏
2022-08-01 22:41:53+00:00,1554235999651233805,"@Jouberth19 HOJE E SEMPRE
CIRO GOMES",Ciro Gomes, hoje e sempreciro gomes
2022-08-01 22:41:48+00:00,1554235981334822912,"@DudaSalabert @cirogomes Se proteja Duda, só ande com vários amigos. 
✊️🌹",Ciro Gomes,"  se proteja duda, só ande com vários amigos. ✊️🌹"
2022-08-01 22:41:31+00:00,1554235909834510340,@DespolarizaRN @cirogomes Muito obrigada! 🤭❤️,Ciro Gomes,  muito obrigada! 🤭❤️
2022-08-01 22:41:24+00:00,1554235880780533760,"@DudaSalabert @cirogomes Um ""presidente"" que se nega a falar das pautas identitárias?",Ciro Gomes,"  um ""presidente"" que se nega a falar das pautas identitárias?"
2022-08-01 22:41:18+00:00,1554235853098082305,é a última vez que tento ajudar ciro gomes acho que ia render um debate entre ele e o nando moura igual rendeu o do gregorio,Ciro Gomes,é a última vez que tento ajudar ciro gomes acho que ia render um debate entre ele e o nando moura igual rendeu o do gregorio
2022-08-01 22:41:09+00:00,1554235816775487488,@cirogomes Ciro e lula briga de lixos https://t.co/GJl8viqbyD,Ciro Gomes, ciro e lula briga de lixos 
2022-08-01 22:40:56+00:00,1554235762253729794,@Cibele_12C @deluca_joao @cirogomes 👏👏👏👏,Ciro Gomes,   👏👏👏👏
2022-08-01 22:40:29+00:00,1554235647526948870,"@AnaKurama12 @cirogomes Obrigada, Aninha!❤️",Ciro Gomes,"  obrigada, aninha!❤️"
2022-08-01 22:40:23+00:00,1554235625078923271,"@mmarescast @cirogomes @Cibele_12C Lula não pode mais vim nas próximas eleições, nem o bozo ,  aí o ciro6%, fica livre se achando o ""novo"" Lula, ou nova direita . Será jogado na sargeta",Ciro Gomes,"   lula não pode mais vim nas próximas eleições, nem o bozo ,  aí o ciro6%, fica livre se achando o ""novo"" lula, ou nova direita . será jogado na sargeta"
2022-08-01 22:40:21+00:00,1554235616732266502,"@cirogomes Não é interessante, para o projeto do Ciro de chegar a presidência, ter o Lula na Planalto em 2026. Ciro sabe que o governo Lula vai reconstruir o país, restaurar o poder de compra do brasileiro e elevar o Brasil no cenário mundial. Ciro Gomes só pensa no seu próprio umbigo.",Ciro Gomes," não é interessante, para o projeto do ciro de chegar a presidência, ter o lula na planalto em 2026. ciro sabe que o governo lula vai reconstruir o país, restaurar o poder de compra do brasileiro e elevar o brasil no cenário mundial. ciro gomes só pensa no seu próprio umbigo."
2022-08-01 22:40:17+00:00,1554235597241434113,"@cirogomes carai cirista tá pior que bolsonarista,nossa vcs não se preocupam com o pais não,tão igualzinho o seu lider ae, só pensam em estarem certos olhando pro proprio umbingo e repetindo mentiras para se transformarem em verdade,nem sei o que ces tão precisando mas vão ao médico gente.",Ciro Gomes," carai cirista tá pior que bolsonarista,nossa vcs não se preocupam com o pais não,tão igualzinho o seu lider ae, só pensam em estarem certos olhando pro proprio umbingo e repetindo mentiras para se transformarem em verdade,nem sei o que ces tão precisando mas vão ao médico gente."
2022-08-01 22:40:16+00:00,1554235591889485826,@canalsoloutubro @cirogomes 🎯,Ciro Gomes,  🎯
2022-08-01 22:40:04+00:00,1554235542111457291,@_Lusitano_ @cirogomes Obrigada! ❤️,Ciro Gomes,  obrigada! ❤️
2022-08-01 22:40:00+00:00,1554235525451505664,"VOCÊ VIU?
Ciro Gomes divulgou uma ação publicitária em que é colocado como Mestre dos Magos, e virou alvo de piadas na Internet. 

https://t.co/hASDY8yamu",Ciro Gomes,"você viu?ciro gomes divulgou uma ação publicitária em que é colocado como mestre dos magos, e virou alvo de piadas na internet. "
2022-08-01 22:39:53+00:00,1554235495567265793,"@cirogomes @Cibele_12C Parabéns, querida @Cibele_12C. Tudo de bom hoje e sempre! 👏",Ciro Gomes,"  parabéns, querida  tudo de bom hoje e sempre! 👏"
2022-08-01 22:39:50+00:00,1554235483462533121,"@cirogomes @gioewbank Eita, já foi lá mesmo?",Ciro Gomes,"  eita, já foi lá mesmo?"
2022-08-01 22:39:46+00:00,1554235469910663174,@DanielBrRam @cirogomes @GabrielaSalerno @PDT_Nacional 👏🏼👏🏼👏🏼👏🏼👏🏼1️⃣2️⃣👏🏼🌹,Ciro Gomes,    👏🏼👏🏼👏🏼👏🏼👏🏼1️⃣2️⃣👏🏼🌹
2022-08-01 22:39:35+00:00,1554235422011785217,"@leiladovolei Com certeza,será o inicio de uma nova era para politica em nosso Pais.
TOMARA QUE MEUS IRMÃOS BRASILEIROS ELEJA CIRO GOMES PRESIDENTE DO BRASIL.",Ciro Gomes," com certeza,será o inicio de uma nova era para politica em nosso pais.tomara que meus irmãos brasileiros eleja ciro gomes presidente do brasil."
2022-08-01 22:39:35+00:00,1554235421734862848,@DanielBrRam @cirogomes @GabrielaSalerno @PDT_Nacional 👏🏼👏🏼👏🏼👏🏼👏🏼👏🏼👏🏼🌹,Ciro Gomes,    👏🏼👏🏼👏🏼👏🏼👏🏼👏🏼👏🏼🌹
2022-08-01 22:39:30+00:00,1554235399937163266,@cirogomes @caiofabiovvtv https://t.co/0WyeZxd5IP,Ciro Gomes,  
2022-08-01 22:39:27+00:00,1554235387668832257,@deluca_joao @cirogomes A mão chega a tremer hahahahah ❤️,Ciro Gomes,  a mão chega a tremer hahahahah ❤️
2022-08-01 22:39:19+00:00,1554235354940579840,@Cibele_12C @cirogomes É seu dia! Curta haha ❤️,Ciro Gomes,  é seu dia! curta haha ❤️
2022-08-01 22:39:13+00:00,1554235329267253248,@cirogomes @gioewbank https://t.co/0WyeZxd5IP,Ciro Gomes,  
2022-08-01 22:39:12+00:00,1554235323642789889,"CHAPA CONFIRMADA

Defensora pública, Carol Braz, é confirmada pelo PDT como candidata ao governo. O vice também é do PDT, o engenheiro Cláudio Machado.

Com a presença de Ciro Gomes, o PDT também lançou Luiz Castro ao senado.

Também foi confirmado que o PDT não fará coligação. https://t.co/A9Y5iyvKGN",Ciro Gomes,"chapa confirmadadefensora pública, carol braz, é confirmada pelo pdt como candidata ao governo. o vice também é do pdt, o engenheiro cláudio machado.com a presença de ciro gomes, o pdt também lançou luiz castro ao senado.também foi confirmado que o pdt não fará coligação. "
2022-08-01 22:39:03+00:00,1554235287827582977,"@cirogomes @DudaSalabert Força e coragem, Duda! ✊🌹",Ciro Gomes,"  força e coragem, duda! ✊🌹"
2022-08-01 22:39:01+00:00,1554235280462434314,@EugnioLemos @cirogomes Somos! ❤️❤️,Ciro Gomes,  somos! ❤️❤️
2022-08-01 22:38:59+00:00,1554235272241582080,@cirogomes https://t.co/0WyeZxd5IP,Ciro Gomes, 
2022-08-01 22:38:56+00:00,1554235259461537792,@sergio_andrad3 @IAcaraje @cirogomes @CartunistaT Sem contar que o mestre dos magos na verdade era pai do vingador!,Ciro Gomes,    sem contar que o mestre dos magos na verdade era pai do vingador!
2022-08-01 22:38:54+00:00,1554235247830736897,"@dediaMaria @cirogomes Amigavelmente discordo. Se não tiver o prefeito, o vereador, o deputado pedindo voto e mantendo o eleitor, somente TV e rede social, não bastam. O corpo a corpo, ainda tem muito valor nos fundões do Brasil.",Ciro Gomes,"  amigavelmente discordo. se não tiver o prefeito, o vereador, o deputado pedindo voto e mantendo o eleitor, somente tv e rede social, não bastam. o corpo a corpo, ainda tem muito valor nos fundões do brasil."
2022-08-01 22:38:53+00:00,1554235246853373959,"Olhem o querem para os nossos filhos e filhas!
Têm certeza que vamos deixar esse futuro para o nosso país?
De verdade, se um esquerdopata dizer que sim, ele não é seu amigo ou sei lá mais o quê.
Ciro Gomes disse: 
""Se ganharem, amanheceremos em uma Guerra Civil"" https://t.co/1eOX3vIkAJ",Ciro Gomes,"olhem o querem para os nossos filhos e filhas!têm certeza que vamos deixar esse futuro para o nosso país?de verdade, se um esquerdopata dizer que sim, ele não é seu amigo ou sei lá mais o quê.ciro gomes disse: ""se ganharem, amanheceremos em uma guerra civil"" "
2022-08-01 22:38:46+00:00,1554235216553803776,@Leg_Ghiri @cirogomes Kkkkkkkkk ❤️,Ciro Gomes,  kkkkkkkkk ❤️
2022-08-01 22:38:45+00:00,1554235212950822912,"@folha LuIa, Temer e BoIsonaro, tudo farinha do mesmo saco podre da política.

Quer alternativa, vota no Ciro Gomes!!
#bolsolulaarregaram 
#CiroPresidente 
#VoteEm1eSeLivreDe2 https://t.co/ChzenI3mZx",Ciro Gomes," luia, temer e boisonaro, tudo farinha do mesmo saco podre da política.quer alternativa, vota no ciro gomes!!   "
2022-08-01 22:38:44+00:00,1554235205803618304,"@cirogomes @caiofabiovvtv cirão te trago uma ideia 100% gratuita se liga: chama o nando moura pra ir nesse programa e defende seu livro (suas ideias) que foi chamado de PASTEL DE VENTO pelo nando 
vai bombar paizão",Ciro Gomes,  cirão te trago uma ideia 100% gratuita se liga: chama o nando moura pra ir nesse programa e defende seu livro (suas ideias) que foi chamado de pastel de vento pelo nando vai bombar paizão
2022-08-01 22:38:40+00:00,1554235189936771075,"@cirogomes Meu querido e amigo @cirogomes, sou teu fã e sempre estive a seu a favor nas eleições que participa, mas com essa de apoiar o Lula, me afasto e estendo o meu apoio a Bolsonaro. Meu voto seria seu, como também iria pedir voto para você, não apoio ladrão como o Lula!",Ciro Gomes," meu querido e amigo  sou teu fã e sempre estive a seu a favor nas eleições que participa, mas com essa de apoiar o lula, me afasto e estendo o meu apoio a bolsonaro. meu voto seria seu, como também iria pedir voto para você, não apoio ladrão como o lula!"
2022-08-01 22:38:39+00:00,1554235186556059652,@cirogomes @CartunistaT A resposta do povo do Ceará ao Ciro. https://t.co/ljvQuh1uQb,Ciro Gomes,  a resposta do povo do ceará ao ciro. 
2022-08-01 22:38:35+00:00,1554235170009530368,@cirogomes @DudaSalabert https://t.co/0WyeZxd5IP,Ciro Gomes,  
2022-08-01 22:38:32+00:00,1554235158462697474,@cirogomes Minha alma cativa saúda nosso sangue latino! 💛,Ciro Gomes, minha alma cativa saúda nosso sangue latino! 💛
2022-08-01 22:38:25+00:00,1554235127277961216,Lindo @cirogomes https://t.co/ZOKK4iNZkI,Ciro Gomes,lindo  
2022-08-01 22:38:24+00:00,1554235124291624968,"@cirogomes Muito obrigada pelo apoio, presidente . Precisamos dar um basta nesses grupos odiosos de contornos neonazistas no Brasil.",Ciro Gomes," muito obrigada pelo apoio, presidente . precisamos dar um basta nesses grupos odiosos de contornos neonazistas no brasil."
2022-08-01 22:38:23+00:00,1554235118415450120,@cirogomes https://t.co/0WyeZxd5IP,Ciro Gomes, 
2022-08-01 22:38:14+00:00,1554235083548200962,"@cirogomes @DudaSalabert Força, grande Duda! ✊🌷",Ciro Gomes,"  força, grande duda! ✊🌷"
2022-08-01 22:38:09+00:00,1554235062434123776,"@cirogomes Muito obrigada pela lembrança e carinho, meu presidente!❤️🌹

Misericórdia... Meu coração não aguenta tanta emoção.🥺🫶🏻❤️",Ciro Gomes," muito obrigada pela lembrança e carinho, meu presidente!❤️🌹misericórdia... meu coração não aguenta tanta emoção.🥺🫶🏻❤️"
2022-08-01 22:37:47+00:00,1554234969513373696,"Aprende @cirogomes o que é respeito e solidariedade.  
Aprende a ser gente https://t.co/4Gbx9cye9F",Ciro Gomes,aprende  o que é respeito e solidariedade.  aprende a ser gente 
2022-08-01 22:36:58+00:00,1554234765267668992,"@MarceloLessmann @cirogomes Coronel Ciro, aquele que toca o trator em cima das pessoas?... realmente vocês se merecem! Kkk",Ciro Gomes,"  coronel ciro, aquele que toca o trator em cima das pessoas?... realmente vocês se merecem! kkk"
2022-08-01 22:36:41+00:00,1554234693217914880,"Queria o @cirogomes na convenção estadual do PDT amanhã aqui em Belém, poxa 🥲",Ciro Gomes,"queria o  na convenção estadual do pdt amanhã aqui em belém, poxa 🥲"
2022-08-01 22:36:36+00:00,1554234671524888578,"@Camille00810452 @d_gaspar7 @hiurezin1 @ValentinoBem @HBurningBlue @thiamparo Por acaso conheço relativamente bem o Brasil e os seus meandros políticos. Numa óptica brasileira Portugal é quase comunista…logo só estou brincando e não ridicularizando. 
Aprecio por ex Ciro Gomes, entre outros. 
Lula foi ilibado por erro de juízo. Não por ser inocente.",Ciro Gomes,"      por acaso conheço relativamente bem o brasil e os seus meandros políticos. numa óptica brasileira portugal é quase comunista…logo só estou brincando e não ridicularizando. aprecio por ex ciro gomes, entre outros. lula foi ilibado por erro de juízo. não por ser inocente."
2022-08-01 22:36:35+00:00,1554234668026941440,"@cirogomes @CartunistaT ALERTA VERMELHO!
https://t.co/uKI7fydive",Ciro Gomes,  alerta vermelho!
2022-08-01 22:36:15+00:00,1554234581217337344,"@cirogomes @Cibele_12C Ciro meu querido, o resto da turma boa fica com inveja.
Kkkkkkkkkk
Parabéns @Cibele_12C , muita saúde, muito amor para você!",Ciro Gomes,"  ciro meu querido, o resto da turma boa fica com inveja.kkkkkkkkkkparabéns  , muita saúde, muito amor para você!"
2022-08-01 22:36:12+00:00,1554234571654414352,"@cirogomes @gioewbank Já parti pra cima de macho branco acusando filho meu de ladrão.
Já fomos seguidos por seguranças.
Já me ofereceram ajuda (por estar andando com meu filho do lado).
O racismo é uma doença.
Não tem remédio, mas tem cura.",Ciro Gomes,"  já parti pra cima de macho branco acusando filho meu de ladrão.já fomos seguidos por seguranças.já me ofereceram ajuda (por estar andando com meu filho do lado).o racismo é uma doença.não tem remédio, mas tem cura."
2022-08-01 22:36:07+00:00,1554234547495178242,"@BLOGdoPEPE Vc deveria respeitar @cirogomes , Alexandre. Ele acusa a quadrilha com provas, esqueceu?",Ciro Gomes," vc deveria respeitar  , alexandre. ele acusa a quadrilha com provas, esqueceu?"
2022-08-01 22:36:03+00:00,1554234534195077121,"@cirogomes @caiofabiovvtv ALERTA! 
https://t.co/uKI7fydive",Ciro Gomes,  alerta! 
2022-08-01 22:35:55+00:00,1554234498845495297,"@AtenaRoveda @cirogomes Mais um pra correr
. https://t.co/V09yrzuUUZ",Ciro Gomes,  mais um pra correr. 
2022-08-01 22:35:44+00:00,1554234452770840577,@JosArana @cirogomes 🤣🤣🤣🤣🤣🤣🤣,Ciro Gomes,  🤣🤣🤣🤣🤣🤣🤣
2022-08-01 22:35:25+00:00,1554234374085918723,@cirogomes https://t.co/uKI7fydive,Ciro Gomes, 
2022-08-01 22:35:21+00:00,1554234355890864128,@hablaruan @fabioojuca @cirogomes @DudaSalabert Que isso Turma Boa?,Ciro Gomes,    que isso turma boa?
2022-08-01 22:35:17+00:00,1554234340179148800,@dediaMaria @ferrari_carol @DudaSalabert @ricardoalvves @pdt Todo candidato é ficha limpa. A lei da ficha limpa consiste exatamente em barrar candidaturas que não o sejam. Lula não tem que explicar crimes alheios. O nanico Ciro Gomes nunca explicou os crimes do PDS. https://t.co/zAzQmwW86x,Ciro Gomes,     todo candidato é ficha limpa. a lei da ficha limpa consiste exatamente em barrar candidaturas que não o sejam. lula não tem que explicar crimes alheios. o nanico ciro gomes nunca explicou os crimes do pds. 
2022-08-01 22:35:15+00:00,1554234332239335424,@cirogomes https://t.co/xQs8bPYayf,Ciro Gomes, 
