Data_Hora,Id_Tweet,Tweet,Candidato,Tweet_limpo
2022-08-01 22:42:31+00:00,1554236160322539524,@ptbrasil @LulaOficial Na urra eletrônica fraudada você quer dizer né? Mas não vai dar não.,Lula,  na urra eletrônica fraudada você quer dizer né? mas não vai dar não.
2022-08-01 22:42:31+00:00,1554236158992961537,@LulaOficial @ricardostuckert Esse mente,Lula,  esse mente
2022-08-01 22:42:29+00:00,1554236153099870208,"@AdamBravo79 @AnarcoFino ""Muito melhor"" : 
Desistir da campanha 
Apoiar Lula
Aceitar ser ministro 
2026 ser eleito,caso Lula não escolher outro 
🤣🤣🤣",Lula,"  ""muito melhor"" : desistir da campanha apoiar lulaaceitar ser ministro 2026 ser eleito,caso lula não escolher outro 🤣🤣🤣"
2022-08-01 22:42:29+00:00,1554236151858331648,"@extraclassejor No Rio Grande do Sul, Edgar Pretto Governador do Rio Grande do Sul é 13 PT, em 02 de outubro, nas urnas eletrônicas. Olívio Dutra Senador do Rio Grande do Sul, é 13 PT. Lula Presidente é PT 13, em 02 de outubro, no primeiro turno, nas urnas eletrônicas.",Lula," no rio grande do sul, edgar pretto governador do rio grande do sul é 13 pt, em 02 de outubro, nas urnas eletrônicas. olívio dutra senador do rio grande do sul, é 13 pt. lula presidente é pt 13, em 02 de outubro, no primeiro turno, nas urnas eletrônicas."
2022-08-01 22:42:26+00:00,1554236139636129792,@LulaOficial @ricardostuckert https://t.co/vMx0w3qg6L,Lula,  
2022-08-01 22:42:26+00:00,1554236137555779585,Quem poderia imaginar? A filhotinha dos globalistas apoiando Lula... https://t.co/6uLQzF5wqX,Lula,quem poderia imaginar? a filhotinha dos globalistas apoiando lula... 
2022-08-01 22:42:25+00:00,1554236135274168323,@Flavio76852691 E o l Lula tá como? https://t.co/HkmLAPBuXy,Lula, e o l lula tá como? 
2022-08-01 22:42:24+00:00,1554236129527955456,O Lula é  um ladrão  profissional https://t.co/gw5n4V38ok,Lula,o lula é  um ladrão  profissional 
2022-08-01 22:42:23+00:00,1554236127434915840,@senadorhumberto @LulaOficial KKKKKK! SONHA DRÁCULA!,Lula,  kkkkkk! sonha drácula!
2022-08-01 22:42:23+00:00,1554236124809273344,@kimpaim E o PT em? E o Lula?,Lula, e o pt em? e o lula?
2022-08-01 22:42:22+00:00,1554236122737385475,Ciro viu o Lula se corromper e denunciou na data. #cirogomes #corrupção ... https://t.co/PHSq4k6f7Q via @YouTube,Lula,ciro viu o lula se corromper e denunciou na data.   ...  via 
2022-08-01 22:42:22+00:00,1554236121638490116,@bielvaquer @NoticiasdaTV Isso é igual a escolher entre lula x bolsonaro. Dois lixos,Lula,  isso é igual a escolher entre lula x bolsonaro. dois lixos
2022-08-01 22:42:22+00:00,1554236120279416832,"@alfredolimaaaa @LulaOficial @ptbrasil escondam suas carteiras ao serem atendidos por isso, prefiro morrer.",Lula,"   escondam suas carteiras ao serem atendidos por isso, prefiro morrer."
2022-08-01 22:42:20+00:00,1554236115867111425,"@g1 Roberto Jefferson foi condenado e cumpriu sua pena, já o ladrão de 9 dedos foi descondenado e solto, pelo STF, na maior aberração jurídica, para hoje ser o candidato preferido dos comunistas à presidência.
Lula continua sendo um condenado, Roberto Jeferson não.",Lula," roberto jefferson foi condenado e cumpriu sua pena, já o ladrão de 9 dedos foi descondenado e solto, pelo stf, na maior aberração jurídica, para hoje ser o candidato preferido dos comunistas à presidência.lula continua sendo um condenado, roberto jeferson não."
2022-08-01 22:42:20+00:00,1554236113069527042,"@EliasRidan @JooAG7 @MARTINHO77 @LulaOficial Na eleição de 2018,as pesquisas bateram encima da pinta,então ñ tem muito o que contestar,mas quem acredita no Capetão,até viver sem oxigênio é possivel.!!!!🤣🤣🤣🤣🤣🤣",Lula,"    na eleição de 2018,as pesquisas bateram encima da pinta,então ñ tem muito o que contestar,mas quem acredita no capetão,até viver sem oxigênio é possivel.!!!!🤣🤣🤣🤣🤣🤣"
2022-08-01 22:42:18+00:00,1554236106186674177,"A guerra de consoles acabou. Agora a guerra é entre a própria comunidade Xbox. Segundo Lula do Xbox, agora existem os “Caixistas limpinhos”. Mais um argumento pra passar pano para os crimes e mentiras deles. https://t.co/p8CTt18ptV",Lula,"a guerra de consoles acabou. agora a guerra é entre a própria comunidade xbox. segundo lula do xbox, agora existem os “caixistas limpinhos”. mais um argumento pra passar pano para os crimes e mentiras deles. "
2022-08-01 22:42:15+00:00,1554236091053514753,"@LulaOficial kkkkkkkkkkkkk
Que pessoa ridícula.
Esse velho deveria estar curtindo o alto salário que pagamos a ele por ter nos roubado durante anos e fica fazendo esse papel de bom velhinho.
kkkkkkkkkkkkkkkkkkkkk",Lula, kkkkkkkkkkkkkque pessoa ridícula.esse velho deveria estar curtindo o alto salário que pagamos a ele por ter nos roubado durante anos e fica fazendo esse papel de bom velhinho.kkkkkkkkkkkkkkkkkkkkk
2022-08-01 22:42:12+00:00,1554236081494794245,"@LulaOficial O MAIOR LADRÃO QUE ESSE PAÍS JÁ PRODUZIU e SEUS CAPACHOS TOGADOS PRETENDEM DEVOLVER O RATO AO PODER PARA VOLTAREM A METER A MÃO NO ERÁRIO PÚBLICO.
#STFOrganizacaoCriminosa https://t.co/v0NJTPKsOw",Lula, o maior ladrão que esse país já produziu e seus capachos togados pretendem devolver o rato ao poder para voltarem a meter a mão no erário público. 
2022-08-01 22:42:12+00:00,1554236080534310914,"@phchem @luannokka @CentralEleicoes E eu estou defendendo a condenação do Lula? Pelo amor de Deus... Depois a gente chama de extremista e vocês não gostam. Se nem concordando dá para ter diálogo, imagina discordando.",Lula,"   e eu estou defendendo a condenação do lula? pelo amor de deus... depois a gente chama de extremista e vocês não gostam. se nem concordando dá para ter diálogo, imagina discordando."
2022-08-01 22:42:12+00:00,1554236079515074561,@LulaOficial @ricardostuckert Tinha não dá pra ver ao fundo .tem ninguém.,Lula,  tinha não dá pra ver ao fundo .tem ninguém.
2022-08-01 22:42:11+00:00,1554236075253669888,"@LulaOficial Luladrão é um calhorda, canalha, criminoso, bandido, corrupto, ladrão, vagabundo, vigarista, estelionatário, mau-caráter, marginal, pilantra, genocida, assassino, salafrário, asqueroso, contagioso, FDP.",Lula," luladrão é um calhorda, canalha, criminoso, bandido, corrupto, ladrão, vagabundo, vigarista, estelionatário, mau-caráter, marginal, pilantra, genocida, assassino, salafrário, asqueroso, contagioso, fdp."
2022-08-01 22:42:06+00:00,1554236056161189889,@MarceloFreixo @LulaOficial Virada? Mas o larápio não está liderando as pesquisas com sobra e vai ganhar no primeiro turno?,Lula,  virada? mas o larápio não está liderando as pesquisas com sobra e vai ganhar no primeiro turno?
2022-08-01 22:42:03+00:00,1554236042680700928,"@LulaOficial Com a palavra, o ex-presidente da #EsquerdaNuncaMais https://t.co/diKAXdB70Q",Lula," com a palavra, o ex-presidente da  "
2022-08-01 22:42:02+00:00,1554236039782453252,"@revistaforum Pegue os 600,00. Gaste. E vote em Lula.",Lula," pegue os 600,00. gaste. e vote em lula."
2022-08-01 22:42:02+00:00,1554236039522312193,"depois de 8 meses no grupo do antigo prédio em q eu morava agindo como se eu ainda morasse lá me baniram do grupo do zap

todos os dias prendem um Lula",Lula,depois de 8 meses no grupo do antigo prédio em q eu morava agindo como se eu ainda morasse lá me baniram do grupo do zaptodos os dias prendem um lula
2022-08-01 22:42:01+00:00,1554236034459865091,"@BlogdoNoblat 20 mil tontos e 1 o velho Noblat!  Vou resumir a eleição, Lula perde e encerra sua história maligna na política, estressado pelos dias que antecedem a eleição, passa mal e o capeta recebe de braços abertos! Vai ser festa igual a copa do mundo! O Brasil se livra do mal!",Lula," 20 mil tontos e 1 o velho noblat!  vou resumir a eleição, lula perde e encerra sua história maligna na política, estressado pelos dias que antecedem a eleição, passa mal e o capeta recebe de braços abertos! vai ser festa igual a copa do mundo! o brasil se livra do mal!"
2022-08-01 22:42:01+00:00,1554236032865935361,"O estudante que comprovar renda familiar bruta de até 1,5 salário mínimo por pessoa pode ter bolsa integral; saiba mais sobre o programa criado no primeiro mandato do presidente Lula https://t.co/vYxHzLYH5V 
#Resistencia1578Dias #LulaNo1ºTurno
Siga nosso Instagram @DilmaResiste",Lula,"o estudante que comprovar renda familiar bruta de até 1,5 salário mínimo por pessoa pode ter bolsa integral; saiba mais sobre o programa criado no primeiro mandato do presidente lula    nosso instagram "
2022-08-01 22:41:57+00:00,1554236019024732160,@heldersalomao O povo precisa ser incluído no orçamento! Onde há justiça social não há necessidade de 'esmola'. Voto Lula pela justiça social! #LulaNoPrimeiroTurno,Lula, o povo precisa ser incluído no orçamento! onde há justiça social não há necessidade de 'esmola'. voto lula pela justiça social! 
2022-08-01 22:41:57+00:00,1554236017875591169,"@LulaOficial Fanfarrão, mentiroso...",Lula," fanfarrão, mentiroso..."
2022-08-01 22:41:57+00:00,1554236016650772480,"Vou votar no Lula alimentado pela crença de que ele vai começar o discurso dele em 01/01/2023 dizendo ""em primeiro lugar, companheiros e companheiras, gostaria de agradecer ao povo brasileiro e dizer chupa Moro, chupa Bolsonaro, chupa Globo, chupa mídia golpista..."" Eu acredito.",Lula,"vou votar no lula alimentado pela crença de que ele vai começar o discurso dele em 01/01/2023 dizendo ""em primeiro lugar, companheiros e companheiras, gostaria de agradecer ao povo brasileiro e dizer chupa moro, chupa bolsonaro, chupa globo, chupa mídia golpista..."" eu acredito."
2022-08-01 22:41:56+00:00,1554236012083257346,@brasil247 Lula quer fazer igualzinho aqui. https://t.co/gZXaCfioE9,Lula, lula quer fazer igualzinho aqui. 
2022-08-01 22:41:56+00:00,1554236011718316034,"@LulaOficial O que passa na cabeça desses esquerdopatas débeis mentais, acéfalos, retardados, inúteis, preguiçosos, parasitas, doutrinados, alienados, energúmenos, bucéfalos anácronos que não enxergam um palmo adiante do nariz e ficam gritando lula livre?",Lula," o que passa na cabeça desses esquerdopatas débeis mentais, acéfalos, retardados, inúteis, preguiçosos, parasitas, doutrinados, alienados, energúmenos, bucéfalos anácronos que não enxergam um palmo adiante do nariz e ficam gritando lula livre?"
2022-08-01 22:41:56+00:00,1554236011336679435,"@LulaOficial Tá fraco de curtida hem???
Não é o 1 nas pesquisas??",Lula, tá fraco de curtida hem???não é o 1 nas pesquisas??
2022-08-01 22:41:55+00:00,1554236010778836992,"Adorei o que a @madeleinelacsko disse há pouco e vou livre interpretar aqui: o @AndreJanonesAdv é um Levy Fidelix repaginado, pronto a bater em Ciro a pedidos de Lula ""Don King"" da Silva, como um pugilista de estilo 'locável para debates' https://t.co/JjTaf4POWB",Lula,"adorei o que a  disse há pouco e vou livre interpretar aqui: o  é um levy fidelix repaginado, pronto a bater em ciro a pedidos de lula ""don king"" da silva, como um pugilista de estilo 'locável para debates' "
2022-08-01 22:41:55+00:00,1554236010661298189,"Por que vcs da Globo não fala sobre a fome Na África ( AgroAfricano)  ? 
Agua aonde tem seca igual lula fez no Nordeste 
Voces vão para outro país arrumar briga e confusão com quem é assim 
Pq nao usam a Globo pra melhorar a vida Deles ? Agua e Alimento ? 
Canalhas mil vezes",Lula,por que vcs da globo não fala sobre a fome na áfrica ( agroafricano)  ? agua aonde tem seca igual lula fez no nordeste voces vão para outro país arrumar briga e confusão com quem é assim pq nao usam a globo pra melhorar a vida deles ? agua e alimento ? canalhas mil vezes
2022-08-01 22:41:54+00:00,1554236004533506048,@_Bruta_Flor_ @LulaOficial ❤️ https://t.co/cqnHkb4Iml,Lula,  ❤️ 
2022-08-01 22:41:53+00:00,1554236000410402818,"@LulaOficial Sim, vai dar certo ... não vai surgir ninguém para ser o chefe deles.",Lula," sim, vai dar certo ... não vai surgir ninguém para ser o chefe deles."
2022-08-01 22:41:50+00:00,1554235989538775048,"@laderechadiario Cuando regrese Lula Da Silva volverá a imponer esos tributos para ganarse el aplauso del pueblo, con los sobornos respectivos a los empresarios, tal como era costumbre.",Lula," cuando regrese lula da silva volverá a imponer esos tributos para ganarse el aplauso del pueblo, con los sobornos respectivos a los empresarios, tal como era costumbre."
2022-08-01 22:41:47+00:00,1554235975781556230,"@barbrichthofen @Ownerthesea @LulaOficial @ricardostuckert Menina, olha quanto era o salário mínimo na época. Não dá pra comprar! O mundo mudou, tudo inflacionou, ainda mais com a pandemia e uma guerra que está acontecendo. É mesmo assim nosso país cresceu e desenvolveu. Aproveita que vc está a toa e vai estudar. Sério!",Lula,"    menina, olha quanto era o salário mínimo na época. não dá pra comprar! o mundo mudou, tudo inflacionou, ainda mais com a pandemia e uma guerra que está acontecendo. é mesmo assim nosso país cresceu e desenvolveu. aproveita que vc está a toa e vai estudar. sério!"
2022-08-01 22:41:47+00:00,1554235973558468608,"@folha_mercado No tempo de Lula,era $ 84,00 ninguém falava nada agora $ 600 toda mídia reclamar taxa desemprego tá caindo vamos procurar emprego pra não depender de bolsa família.",Lula," no tempo de lula,era $ 84,00 ninguém falava nada agora $ 600 toda mídia reclamar taxa desemprego tá caindo vamos procurar emprego pra não depender de bolsa família."
2022-08-01 22:41:46+00:00,1554235971507560448,"@LulaOficial @ricardostuckert Mentiroso, ladrão, cachaceiro....
#LulaLadraoSeuLugarENaPrisao",Lula,"  mentiroso, ladrão, cachaceiro...."
2022-08-01 22:41:46+00:00,1554235969892646913,"Segundo pesquisas sérias, Bolsonaro derrubará Lula logo no 1o turno e não no 2o.",Lula,"segundo pesquisas sérias, bolsonaro derrubará lula logo no 1o turno e não no 2o."
2022-08-01 22:41:45+00:00,1554235967363588098,@LulaOficial Coitados !!!,Lula, coitados !!!
2022-08-01 22:41:45+00:00,1554235966939955215,Chapa Lula-Alckmin tem tudo para ser o maior monumento à falsificação já construído na política https://t.co/vxU4GBqxlh,Lula,chapa lula-alckmin tem tudo para ser o maior monumento à falsificação já construído na política 
2022-08-01 22:41:45+00:00,1554235966285615105,"@OGlobo_Rio ESSE É O PRESIDENTE QUE A REDE BOBO ACHOU MELHOR QUE DILMA E LULA,VCS MARINHOS TEM SANGUE NAS MÃOS 🤥🤑💩🤥🤑💩",Lula," esse é o presidente que a rede bobo achou melhor que dilma e lula,vcs marinhos tem sangue nas mãos 🤥🤑💩🤥🤑💩"
2022-08-01 22:41:45+00:00,1554235966159822849,"@guimaraes13PT @LulaOficial @geraldoalckmin Deus nos Livre de vocês!
#BolsonaroReeleitoEm2022",Lula,   deus nos livre de vocês!
2022-08-01 22:41:43+00:00,1554235960208117768,@LulaOficial https://t.co/4OWD16vnVG,Lula, 
2022-08-01 22:41:43+00:00,1554235958865829890,"@Jouberth19 Eu ia votar nulo, devo votar no Lula então?",Lula," eu ia votar nulo, devo votar no lula então?"
2022-08-01 22:41:43+00:00,1554235958832283650,"@bahiaminhaporra @fabiomarinhojr @miropalma Animal, Lula governou o país por 8 anos e teve recorde de aprovação popular. Qual foi o passo que o Brasil deu para o comunismo durante o governo dele? Se comporte como um ser humano e não a porra de um papagaio que só repete palavras desconexas achando estar fazendo sentido",Lula,"   animal, lula governou o país por 8 anos e teve recorde de aprovação popular. qual foi o passo que o brasil deu para o comunismo durante o governo dele? se comporte como um ser humano e não a porra de um papagaio que só repete palavras desconexas achando estar fazendo sentido"
2022-08-01 22:41:43+00:00,1554235956756111360,"Estou indignado por ter sido bloqueado pelo Lula! Como pode? Um presidenciável, perdendo tempo para CENSURAR um cidadão e eleitor. Tem tanto medo da verdade? Não quer que outros a enxerguem? A que nível chegou a censura nesse país, e a que nível chegará se Lula assumir o poder... https://t.co/DEsPUxkUXN",Lula,"estou indignado por ter sido bloqueado pelo lula! como pode? um presidenciável, perdendo tempo para censurar um cidadão e eleitor. tem tanto medo da verdade? não quer que outros a enxerguem? a que nível chegou a censura nesse país, e a que nível chegará se lula assumir o poder... "
2022-08-01 22:41:42+00:00,1554235955111936003,"@LulaOficial @ricardostuckert Vagabundo,marginal!
Vç quer voltar a cena do crime para por em pratica o Projeto Patria Grande com o qual integra a AL atraves da agenda comunista !",Lula,"  vagabundo,marginal!vç quer voltar a cena do crime para por em pratica o projeto patria grande com o qual integra a al atraves da agenda comunista !"
2022-08-01 22:41:41+00:00,1554235951731417089,"@LulaOficial Po, vai derrubar leite na cama",Lula," po, vai derrubar leite na cama"
2022-08-01 22:41:41+00:00,1554235951395880962,@blogdopannunzio @LulaOficial Faltam pouco para vocês perderem o que resta da mamata,Lula,  faltam pouco para vocês perderem o que resta da mamata
2022-08-01 22:41:40+00:00,1554235946706636802,"@cappellarianton @AraujoHelmer LULA 
GIGANTE 
BRASILEIRO 
❤️🌺☀️🇧🇷🤩
#LulaEoPTReconstruirOBrasil",Lula,  lula gigante brasileiro ❤️🌺☀️🇧🇷🤩
2022-08-01 22:41:39+00:00,1554235939916025857,"@flferronato @ThiagoResiste Esse rapaz é gamado no Lula, só pode ser amor",Lula,"  esse rapaz é gamado no lula, só pode ser amor"
2022-08-01 22:41:36+00:00,1554235928742449152,@RicardoFronczak @LulaOficial 😂,Lula,  😂
2022-08-01 22:41:35+00:00,1554235925823111174,@Seraphico22 @LulaOficial Idem acredito 100%,Lula,  idem acredito 100%
2022-08-01 22:41:32+00:00,1554235912510443520,"@marcelocostabh @JornalismoWando Pq eu posso compartilhar o Ciro sendo Sabatinado como nesse link, pq Lula não vai? Tá com vergonha ou tá Arregando msm? https://t.co/zUszQnqHgS",Lula,"  pq eu posso compartilhar o ciro sendo sabatinado como nesse link, pq lula não vai? tá com vergonha ou tá arregando msm? "
2022-08-01 22:41:30+00:00,1554235905346527232,"@LulaOficial Eu sei muito bem o que você quer, seu canalha.",Lula," eu sei muito bem o que você quer, seu canalha."
2022-08-01 22:41:27+00:00,1554235892507754499,"#SouLula
Kkkkk.
Muuuuuu.

É LULA PRESIDENTE https://t.co/dfaK8xMbsi",Lula, lula presidente 
2022-08-01 22:41:26+00:00,1554235888690991105,"@juniomagela @felipe_alr @sobotelha Já tentaram ano passado com uma PEC de senador vitalício para todos os ex presidentes, não?
(Se fosse condição Bolsonaro e Lula desistirem de concorrer não sei se não era uma boa...)",Lula,"   já tentaram ano passado com uma pec de senador vitalício para todos os ex presidentes, não?(se fosse condição bolsonaro e lula desistirem de concorrer não sei se não era uma boa...)"
2022-08-01 22:41:26+00:00,1554235887084617730,@LulaOficial Fazer tudo  de novo😢 sai fora ladrão. Aqui vc não vai fazer nada de novo.,Lula, fazer tudo  de novo😢 sai fora ladrão. aqui vc não vai fazer nada de novo.
2022-08-01 22:41:25+00:00,1554235882621779968,@LulaOficial Tem muito verde e amarelo nesse comunismo...,Lula, tem muito verde e amarelo nesse comunismo...
2022-08-01 22:41:25+00:00,1554235881577390087,"@JoseMedeirosMT @jairbolsonaro Quem pode entender um negócio destes. Um empresário importante optando por um representante do socialismo escroto representado por Lula, pois só é socialista aparente, usa o estado para enriquecer sua gang. Não dá pra entender. #EsquerdaCriminosa",Lula,"  quem pode entender um negócio destes. um empresário importante optando por um representante do socialismo escroto representado por lula, pois só é socialista aparente, usa o estado para enriquecer sua gang. não dá pra entender. "
2022-08-01 22:41:24+00:00,1554235878846959616,@LulaOficial Lula ladrãoooooooo teu lugar é na prisão,Lula, lula ladrãoooooooo teu lugar é na prisão
2022-08-01 22:41:24+00:00,1554235878704381954,Motorista e cobrador aqui no busão defendendo o @ptbrasil e o @LulaOficial numa discussão com um passageiro,Lula,motorista e cobrador aqui no busão defendendo o  e o  numa discussão com um passageiro
2022-08-01 22:41:22+00:00,1554235872454873089,@dominguesRobert @Damadeferroofic Miliciano? As fotos foram feitas pelas palavras do Lula https://t.co/reQcffWxlN,Lula,  miliciano? as fotos foram feitas pelas palavras do lula 
2022-08-01 22:41:22+00:00,1554235871905386496,@LulaOficial @ricardostuckert #LulaNuncaMais #LulaVergonhaDoBrasil,Lula,   
2022-08-01 22:41:22+00:00,1554235871846621187,Boa noite. A memória. E @LulaOficial presidente no futuro. Postagem do YouTube por @demori . https://t.co/v7veZVvLQd,Lula,boa noite. a memória. e  presidente no futuro. postagem do youtube por  . 
2022-08-01 22:41:22+00:00,1554235871452332036,"@WilsonPrattis Na verdade o próprio @LulaOficial pede que não façamos nada, pois esse pessoal não é brincadeira, são agressivos e vão partir pra agressão ao supremo ou até mesmo a pessoas. Não adianta confronto. Deixa eles mesmos darem um tiro no pé.",Lula," na verdade o próprio  pede que não façamos nada, pois esse pessoal não é brincadeira, são agressivos e vão partir pra agressão ao supremo ou até mesmo a pessoas. não adianta confronto. deixa eles mesmos darem um tiro no pé."
2022-08-01 22:41:21+00:00,1554235866612375552,@BlogdoNoblat Lula,Lula, lula
2022-08-01 22:41:21+00:00,1554235866205372416,"@ManuelaDavila Princesa @ManuelaDavila, não desista! Você é uma esperança para o Brasil se reencontrar com os direitos humanos, educação, igualdade social, prosperidade econômica e apoio a todos os projetos do governo Lula 🤩🤩🤩",Lula," princesa  não desista! você é uma esperança para o brasil se reencontrar com os direitos humanos, educação, igualdade social, prosperidade econômica e apoio a todos os projetos do governo lula 🤩🤩🤩"
2022-08-01 22:41:20+00:00,1554235860920451073,@LulaOficial @ricardostuckert Truco🤡,Lula,  truco🤡
2022-08-01 22:41:19+00:00,1554235857871290369,@LulaOficial @ricardostuckert Se tinha tanta gente assim por que não teve imagens abertas e do alto para mostrar? Só vi imagem próxima ao palanque fechadas 🤡😂🤡😂🤡😂🤡😂,Lula,  se tinha tanta gente assim por que não teve imagens abertas e do alto para mostrar? só vi imagem próxima ao palanque fechadas 🤡😂🤡😂🤡😂🤡😂
2022-08-01 22:41:18+00:00,1554235854012534802,"@ThiagoResiste QUEM NÃO GOSTA D TRABALHAR, ESTUDAR, SÃO OS PETRALHAS. SÓ OLHAR O HISTÓRICO DO CHEFE-MOR, LULA. UM HOMEM Q MESMO DEPOIS Q TINHA CONDIÇÕES NÃO VOLTOU AOS BANCOS D UMA ESCOLA. NASCEU POBRE? SIM, MAS DEPOIS TEVE OPORTUNIDADE DE ESTUDAR E NÃO O FEZ.",Lula," quem não gosta d trabalhar, estudar, são os petralhas. só olhar o histórico do chefe-mor, lula. um homem q mesmo depois q tinha condições não voltou aos bancos d uma escola. nasceu pobre? sim, mas depois teve oportunidade de estudar e não o fez."
2022-08-01 22:41:17+00:00,1554235850455752710,"@FranGissoni @TchauBozonaro @dwisysix mas até então ele não roubou nada, o lula quando roubou o Brasil também deixou o Brasil na merda e pra crlh, mas enfim, odeio os dois e não gosto de política",Lula,"   mas até então ele não roubou nada, o lula quando roubou o brasil também deixou o brasil na merda e pra crlh, mas enfim, odeio os dois e não gosto de política"
2022-08-01 22:41:15+00:00,1554235839282044928,"🌹🤝Ciro reage no Ceará e o candidato do PDT, Roberto Cláudio, terá apoio de Tasso:

Senador tucano era cortejado por Lula, que tentou levar PSDB para palanque petista no estado.

https://t.co/2CyEMglVIA",Lula,"🌹🤝ciro reage no ceará e o candidato do pdt, roberto cláudio, terá apoio de tasso:senador tucano era cortejado por lula, que tentou levar psdb para palanque petista no estado."
2022-08-01 22:41:14+00:00,1554235836069289984,@LulaOficial Lula ladrãoooooooo teu lugar é na prisão.,Lula, lula ladrãoooooooo teu lugar é na prisão.
2022-08-01 22:41:12+00:00,1554235828204879873,"@diegoguelar Historia de la corrupción judicial instalada por el macrismo. A Moro no le duró mucho la patraña que le armaron a Lula, espero que acá cuando toda la mugre salga a la luz tengamos el segundo Nunca Más.",Lula," historia de la corrupción judicial instalada por el macrismo. a moro no le duró mucho la patraña que le armaron a lula, espero que acá cuando toda la mugre salga a la luz tengamos el segundo nunca más."
2022-08-01 22:41:10+00:00,1554235821187899394,@colombopcb Filhotes de Lula não ficam presos...,Lula, filhotes de lula não ficam presos...
2022-08-01 22:41:10+00:00,1554235820084805632,@LulaOficial https://t.co/WbqsGCt6v7,Lula, 
2022-08-01 22:41:10+00:00,1554235818843193347,@felipeneto De você e raça do Lula https://t.co/CcyKTFkdkT,Lula, de você e raça do lula 
2022-08-01 22:41:09+00:00,1554235816775487488,@cirogomes Ciro e lula briga de lixos https://t.co/GJl8viqbyD,Lula, ciro e lula briga de lixos 
2022-08-01 22:41:08+00:00,1554235812694335494,"@LetciaF26018389 @RoLuchsinger Fique tranquila, se o Lula for eleito ele leva um pai-de-santo para “benzer” o palácio, aí eu quero o que tu vai dizer.",Lula,"  fique tranquila, se o lula for eleito ele leva um pai-de-santo para “benzer” o palácio, aí eu quero o que tu vai dizer."
2022-08-01 22:41:07+00:00,1554235806914678785,@brega_falcao Lula presidente,Lula, lula presidente
2022-08-01 22:41:04+00:00,1554235796697260037,"@LulaOficial Pai da fome!!!!kkkkkk Hipócrita, lambanceiro, e mentiroso, demagogo, até quando vai querer viver da ignorância dos pobres?????",Lula," pai da fome!!!!kkkkkk hipócrita, lambanceiro, e mentiroso, demagogo, até quando vai querer viver da ignorância dos pobres?????"
